{"schemaVersion":"independent-review-runtime-dependency-manifest.v4","platform":{"os":"darwin","arch":"arm64"},"environment":{"nodeOptionsRequiredAbsent":true,"nodePathRequiredAbsent":true,"requiredExecArgv":[]},"node":{"version":"v24.18.0","executablePathSha256":"sha256:9f6c56c2d660d26e7c9e0a532072817600ca1e7fefc88a53953d4958aec6df1e","executableByteLength":120965360,"executableSha256":"sha256:ee6fb0e015284d83a91e8ec5213f43a157f8a392b58555301682892ba928c04a"},"npm":{"version":"11.16.0","launcherTargetSha256":"sha256:073c15c135959de3e43dbea2b38d6e9b6d657fe9d4fc8ca2d3203e7793278bba","cliPathSha256":"sha256:9195e9c14c24ce87afc4e603e7c1933f462a09160a6b1342af944787053571c0","cliByteLength":54,"cliSha256":"sha256:8e5f6f3429f8cdbe693cdc29904e9d5a7b127a494bd15c804bd54c7403bfcbe7","packageJsonSha256":"sha256:60ff022e32b5d8291d3e09849fd0cee6bbbff4e4d8352ad258214b1adf070714","packageTreeEntryCount":1916,"packageTreeByteLength":11989377,"packageTreeSha256":"sha256:248cc8b6ba3b7d4e01fcf5aa8cff9a1f4b3f7803c457330b01ac571a2dd7a93b"},"source":{"packageJsonSha256":"sha256:a4ab3f0fb408dff675054d315d09a9d5a8b0cda75149b30175b311170e29ef9f","packageLockSha256":"sha256:8a7e27bd052d9f6fa1371cc23c153ca40a5a6299a31bdc321169b4ebf68abdcf","localModuleSubjects":[{"path":"lib/independent-model-review.mjs","mode":"0644","byteLength":94674,"sha256":"sha256:bcedda18ed87391fc335f6653fe1928c91ff7ed46a4437a86f09f1713ef6fc8b"},{"path":"lib/independent-review-runtime-binding.mjs","mode":"0644","byteLength":15820,"sha256":"sha256:57418d5fa2c8b0deeac6d023a0f57e8d9a6de997c58e89b42cd0d091331a5fea"},{"path":"lib/independent-review-runtime-manifest.mjs","mode":"0644","byteLength":22441,"sha256":"sha256:1899e6304644094f9d08091a5397647a6573e30aed957a177b01cef29f2e9878"},{"path":"lib/independent-review-transport-evidence.mjs","mode":"0644","byteLength":17083,"sha256":"sha256:c310a934b82fa9e9c89629b7175d8a77c76f454a9bb34498d507f42d433a000f"},{"path":"lib/kimi-k3-independent-review.mjs","mode":"0644","byteLength":148278,"sha256":"sha256:3ec9b519eaebf1101ca6544bc1df2a18224bb48d99f4ca667de4367890813c6f"},{"path":"lib/kimi-k3-review-evidence.mjs","mode":"0644","byteLength":106213,"sha256":"sha256:0fdc6e9a0fb11455e70f080779a377b969e8872d5abddfe34d1e8c506689e20d"},{"path":"lib/kimi-independent-review.mjs","mode":"0644","byteLength":93320,"sha256":"sha256:e765a7cc7949947a19ff361881b52129f3273f9f6f8fea38e653cff8f3768124"},{"path":"lib/p2-start-authorization.mjs","mode":"0644","byteLength":13598,"sha256":"sha256:40c747af5c4c6c88087eeb9017fa6c72061e4a6dc80f9238d3f3a0616f061683"},{"path":"lib/project-control.mjs","mode":"0644","byteLength":42610,"sha256":"sha256:b2b6e0cf4fb18696688e9ec0f6a92edc45fa023527644c0c96a235e079822a1e"},{"path":"scripts/build-independent-review-bundle.mjs","mode":"0644","byteLength":22319,"sha256":"sha256:3e08773a704124256d9a81369e32c65f89c7f549007e598dd2b4768fbfce4be0"},{"path":"scripts/build-independent-review-material.mjs","mode":"0644","byteLength":48546,"sha256":"sha256:fbbaebfd270f9f46fc7c4bbce3ba31c643d8774b87b88ffd6c8a08bb237e60d8"},{"path":"scripts/bootstrap-kimi-independent-review.mjs","mode":"0644","byteLength":15397,"sha256":"sha256:bc6937ee2d146af3d3504603f4f5325f4495fec73b31f825f7fef30fa4258a8d"},{"path":"scripts/launch-kimi-independent-review.sh","mode":"0755","byteLength":346,"sha256":"sha256:12406c5ad17d3bc24f4bd8dc77cb8371da0a42917a6c59bbc8aca9233133daa7"},{"path":"scripts/run-independent-review-test-evidence.mjs","mode":"0644","byteLength":51339,"sha256":"sha256:9fc664bb0a9f6b9dde0b2cd0defe5804355582bd514360e26040e2d0caa6ef94"},{"path":"scripts/run-kimi-independent-review.mjs","mode":"0644","byteLength":114031,"sha256":"sha256:42ef5a9b975a4c3b88b2d87de1f1d291b881876d70beb9f4977fc2097a2f4987"}],"localClosureSha256":"sha256:1de3d72537d37740cff704a08e97081230caa42f50ab4eeb66402d6981be6eed"},"dependencies":{"rootKind":"REPOSITORY_NODE_MODULES","fullTreeEntryCount":29266,"fullTreeByteLength":701486623,"fullTreeSha256":"sha256:0cbe32d1d148a0b1ad0a2134f06a8a5e6b5c27935bf596c5da2bb2279c6aa8f1","criticalPackages":[{"name":"ajv","version":"8.20.0","integrity":"sha512-Thbli+OlOj+iMPYFBVBfJ3OmCAnaSyNn4M1vz9T6Gka5Jt9ba/HIR56joy65tY6kx/FCF5VXNB819Y7/GUrBGA==","packageJsonSha256":"sha256:1f9033ee5a6515e7d76938b7072941862d1ed228a6879cc7fe10cdeb75107989","entryPath":"ajv/dist/2020.js","entrySha256":"sha256:908e9670b478b2ba126802a221b7e47006f50cf467e2c5dd7935d3dbef10a20a","entryCount":466,"totalByteLength":1033496,"manifestSha256":"sha256:9bb85261f7846a56654d1c52c1f36172e075aa184524bf908674c9fc306f21a6"},{"name":"ajv-formats","version":"2.1.1","integrity":"sha512-Wx0Kx52hxE7C18hkMEggYlEifqWZtYaRgouJor+WMdPnQyEK13vgEWyVNup7SoeeoLMsr4kf5h6dOW11I15MUA==","packageJsonSha256":"sha256:dab973bf13d8248fc5f6b2b0b7b3e87fd1dc92a71abdc559fbcbb5c29ed48e63","entryPath":"ajv-formats/dist/index.js","entrySha256":"sha256:25ae29038da0fd1021a623de0db504f2eff2d2e1fed832f3a41b795833182dde","entryCount":15,"totalByteLength":52227,"manifestSha256":"sha256:c4f1117c54ec8384e5f480ed993f3430207e392cdf57350d5c88c708276c6536"},{"name":"fast-deep-equal","version":"3.1.3","integrity":"sha512-f3qQ9oQy9j2AhBe/H9VC91wLmKBCCU/gDOnKNAYG5hswO7BLKj09Hc5HYNz9cGI++xlpDCIgDaitVs03ATR84Q==","packageJsonSha256":"sha256:a5c63940db0260739be9e2ac67f3aac268df4db5770420ee4e34e493152f97d2","entryPath":"fast-deep-equal/index.js","entrySha256":"sha256:eb469e206280321a3878f2335ec98aa2104a155079d8ed83a23029098dccd215","entryCount":11,"totalByteLength":12966,"manifestSha256":"sha256:2baff6fe379f72324b542ea471c0740feea83c4b6612bd9bbdf0e3831219df7c"},{"name":"fast-uri","version":"3.1.2","integrity":"sha512-rVjf7ArG3LTk+FS6Yw81V1DLuZl1bRbNrev6Tmd/9RaroeeRRJhAt7jg/6YFxbvAQXUCavSoZhPPj6oOx+5KjQ==","packageJsonSha256":"sha256:bf5b935d03f7fd78711858e0fd05cff61cbb50169658d8df8964a75400a3e251","entryPath":"fast-uri/index.js","entrySha256":"sha256:f5f641da3dfef3405e01a0fb21dd546bb86dc7fb553f6b26a541265eb22def55","entryCount":34,"totalByteLength":156873,"manifestSha256":"sha256:4d0b4443db19ba8cffef7ea7fa82cfcce3a56becc22fa690f03476c6a846735d"},{"name":"json-schema-traverse","version":"1.0.0","integrity":"sha512-NM8/P9n3XjXhIZn1lLhkFaACTOURQXjWhV4BA/RnOv8xvgqtqpAX9IO4mRQxSx1Rlo4tqzeqb0sOlruaOy3dug==","packageJsonSha256":"sha256:156fb24af02845c190701360d06dfda35ef04282e34a734289ea9535ad9819ae","entryPath":"json-schema-traverse/index.js","entrySha256":"sha256:024191b747afac01b28ff11d744e9f82720bbad5f716163ba5c962eb62aa2350","entryCount":12,"totalByteLength":22220,"manifestSha256":"sha256:417ddb603d17ad3d962ea090e34f597222e963e83e0b24999840d1238889af96"},{"name":"require-from-string","version":"2.0.2","integrity":"sha512-Xf0nWe6RseziFMu+Ap9biiUbmplq6S9/p+7w7YXP/JBHhrUDDUhwa+vANyubuqfZWTveU//DYVGsDG7RKL/vEw==","packageJsonSha256":"sha256:c0002f7d4c7d7e2a885cf0f97226344902417c3a0980f2beca41962d2bc1f6d8","entryPath":"require-from-string/index.js","entrySha256":"sha256:cb059342a762b955997bf780f3693add176922727f2fa9f11fcaf1b3fc323239","entryCount":4,"totalByteLength":3422,"manifestSha256":"sha256:101905de381c9ff6ce7aa8aeb1537abebfa64c8698c2baa8571ac5730d89b2e8"},{"name":"undici","version":"7.24.8","integrity":"sha512-6KQ/+QxK49Z/p3HO6E5ZCZWNnCasyZLa5ExaVYyvPxUwKtbCPMKELJOqh7EqOle0t9cH/7d2TaaTRRa6Nhs4YQ==","packageJsonSha256":"sha256:fff3dacf0b2f12cffb390f41beb3b6feae928084ad1166951f0a93fba28925c8","entryPath":"undici/index.js","entrySha256":"sha256:dca95e2bbf4bae18325a4e5d9c887427a8a63a1345ed92a46f1067360dec0ffa","entryCount":210,"totalByteLength":1610214,"manifestSha256":"sha256:0cdc2df08872e2b1ab696766635f1cef2ee2cf086a695ff344613a4d70308031"}],"criticalPackageSetSha256":"sha256:ea7d3d688c278663a8ce71bb901604532c1ff6b19be8a29d1669d8e7e1b782eb"},"manifestSha256":"sha256:ca02e87be098b5aead86c81cc637de33e379c09b58690ba46e618ca92c7cd9d4"}
